{
  "schemaVersion": "3.0",
  "id": "threats/registry-core",
  "description": "Core threat registry for the two prototype-anchor types (gate G6). Pruning rule R36/§2.12: every entry here is MECHANICAL — it owns balance numbers and changes the player's verb, not just the noun. Demoted codex flavour (stream-sniper, competitor-sponsored attack, hype-cycle-collapse-as-text) attaches to these entries later and does not ship stats. Second Answer rule (§5.1): every threat lists >=2 viable counters at DIFFERENT prices (cheap / expensive / lateral triad). Counters name the 9 defense roles (Absorb, Classify, Meter, Contain, Detect, Recover, Deter, Divert, Negotiate, §2.1). Stats are null + _todo wherever hosting_game.md is qualitative — the loader lint must flag each TODO until the owner re-author sweep fills the numbers (owner ratified sheet B 2026-10-09, docs/adr/0009 — OD-2 CLOSED; wire markers deliberately stay PROVISIONAL-[ABC] until that sweep). Visual-coverage law (§8.18, OD-12(d), ADR-0013 ruling 5d): every entry carries a `visual` slug grounded in the design-doc prose (or an explicit codexOnly tag — none needed while all 16 stay mechanical); validate.mjs fails red on a gap. Lookalike law (§2.4, OD-18, ADR-0013 ruling 9): a threat may carry optional `lookalikeOf` naming the visitor archetype (§3.2) it masquerades as — the mimic's costume, not a new entity; one mimic-seed per shipped type bundle is lint-enforced.",
  "rolesVocabulary": ["Swarm", "Tank", "Sapper", "Stealth", "Splitter", "Healer/Spawner", "Bypass/Flyer", "Siege", "Debuffer", "Mimic", "Parasite", "Boss"],
  "defenseRolesVocabulary": ["Absorb", "Classify", "Meter", "Contain", "Detect", "Recover", "Deter", "Divert", "Negotiate"],
  "bandsVocabulary": ["weather", "storm", "hunter", "entropy"],
  "denominationsVocabulary": ["bandwidth", "concurrency", "hands", "cash", "reputation", "data-integrity"],
  "threats": [
    {
      "id": "scanner-drizzle",
      "family": "malicious",
      "band": "weather",
      "roles": ["Stealth"],
      "motion": "sweep",
      "denomination": "data-integrity",
      "customerAsThreat": false,
      "mechanical": true,
      "visual": "violet-drizzle",
      "lookalikeOf": "crawler",
      "stats": {
        "sophistication": null,
        "volume": null,
        "signature": null,
        "persistence": null,
        "tuningSheet": "PROVISIONAL-B",
        "_todo": "§2.2 authors behaviour (flags advance telegraph for the next 3 levels' targeted attacks) without stat scalars."
      },
      "facts": [
        "Constant drizzle; renders violet (§2.2).",
        "Telegraph function: each scanner that lands pre-announces the next three levels' targeted attacks — the attack-surface ledger's teacher (§2.2, gate G1)."
      ],
      "counters": [
        { "name": "default-deny-firewall", "defenseRole": "Contain", "priceTier": "cheap" },
        { "name": "reduce-exposed-surface", "defenseRole": "Contain", "priceTier": "cheap" },
        { "name": "attack-surface-scanner", "defenseRole": "Detect", "priceTier": "expensive" }
      ]
    },
    {
      "id": "wp-login-brute-squad",
      "family": "malicious",
      "band": "weather",
      "roles": ["Swarm"],
      "motion": "boil",
      "denomination": "concurrency",
      "customerAsThreat": false,
      "mechanical": true,
      "visual": "boiling-lock-picks",
      "stats": {
        "sophistication": null,
        "volume": null,
        "signature": null,
        "persistence": null,
        "tuningSheet": "PROVISIONAL-B",
        "_todo": "§2.2 gives damage basis (CPU: full app bootstrap per attempt; log storage cost) but no stat scalars."
      },
      "facts": [
        "Slow, relentless guessing at /wp-login.php; every attempt boots the whole app — damage is CPU plus log storage, not bandwidth (§2.2)."
      ],
      "counters": [
        { "name": "fail2ban", "defenseRole": "Deter", "priceTier": "cheap" },
        { "name": "login-rate-limit", "defenseRole": "Meter", "priceTier": "cheap" },
        { "name": "two-factor-enforcement", "defenseRole": "Contain", "priceTier": "expensive" },
        { "name": "move-login-url", "defenseRole": "Deter", "priceTier": "lateral", "note": "'cheesy fix rewarded early' (§2.2)." }
      ]
    },
    {
      "id": "xmlrpc-pingback-amplifier",
      "family": "malicious",
      "band": "storm",
      "roles": ["Parasite"],
      "motion": "match",
      "denomination": "reputation",
      "customerAsThreat": false,
      "mechanical": true,
      "visual": "borrowed-weapon",
      "lookalikeOf": "api-client",
      "stats": {
        "sophistication": null,
        "volume": null,
        "signature": null,
        "persistence": null,
        "tuningSheet": "PROVISIONAL-B",
        "_todo": "§2.2 authors the chain (your server attacks someone else -> abuse notice -> null-route threat) without scalars."
      },
      "facts": [
        "Turns your fleet into the weapon: xmlrpc pingback flood launched FROM customer sites; the damage clock is the transit/upstream relationship, not the box (§2.2)."
      ],
      "counters": [
        { "name": "disable-xmlrpc-feature", "defenseRole": "Contain", "priceTier": "cheap" },
        { "name": "egress-filtering", "defenseRole": "Divert", "priceTier": "cheap" },
        { "name": "outbound-rate-limits", "defenseRole": "Meter", "priceTier": "lateral" }
      ]
    },
    {
      "id": "slowloris-sipper",
      "family": "malicious",
      "band": "storm",
      "roles": ["Sapper"],
      "motion": "hold",
      "denomination": "concurrency",
      "customerAsThreat": false,
      "mechanical": true,
      "visual": "quiet-thread-holders",
      "lookalikeOf": "deep-reader",
      "stats": {
        "sophistication": null,
        "volume": null,
        "signature": null,
        "persistence": null,
        "tuningSheet": "PROVISIONAL-B",
        "_todo": "§2.3 authors near-zero bandwidth and thread-hold semantics without scalars."
      },
      "facts": [
        "A handful of visitors sit forever holding worker threads; graphs look fine while the box dies — defeats bandwidth-based detection (§2.3)."
      ],
      "counters": [
        { "name": "connection-timeouts-worker-recycling", "defenseRole": "Contain", "priceTier": "cheap" },
        { "name": "per-ip-concurrency-cap", "defenseRole": "Meter", "priceTier": "cheap" },
        { "name": "l7-req-rate-limit", "defenseRole": "Meter", "priceTier": "lateral", "note": "RUDY variant defeats naive request-rate limits (§2.3)." }
      ]
    },
    {
      "id": "layer7-mimic",
      "family": "malicious",
      "band": "hunter",
      "roles": ["Mimic"],
      "motion": "match",
      "denomination": "concurrency",
      "customerAsThreat": false,
      "mechanical": true,
      "visual": "crowd-suit",
      "lookalikeOf": "power-shopper",
      "stats": {
        "sophistication": null,
        "volume": null,
        "signature": null,
        "persistence": null,
        "tuningSheet": "PROVISIONAL-B",
        "_todo": "§2.4 authors behaviour + counter economics without stat scalars."
      },
      "facts": [
        "Requests the most expensive page at human-plausible rates from thousands of residential IPs — indistinguishable from popularity; rate-limiting it craters conversion (§2.4)."
      ],
      "counters": [
        { "name": "bot-fingerprinter", "defenseRole": "Classify", "priceTier": "expensive", "note": "slow to train; model-poisoning downside (§2.4)." },
        { "name": "cache-the-expensive-page", "defenseRole": "Absorb", "priceTier": "lateral" },
        { "name": "cost-per-request-budget", "defenseRole": "Meter", "priceTier": "lateral" }
      ]
    },
    {
      "id": "vulnerable-plugin-compromise",
      "family": "malicious",
      "band": "storm",
      "roles": ["Bypass/Flyer", "Sapper"],
      "motion": "walk",
      "denomination": "data-integrity",
      "customerAsThreat": false,
      "mechanical": true,
      "visual": "defacement-ripple",
      "stats": {
        "sophistication": null,
        "volume": null,
        "signature": null,
        "persistence": null,
        "tuningSheet": "PROVISIONAL-B",
        "_todo": "§2.5 authors the homogeneity multiplier qualitatively."
      },
      "facts": [
        "One outdated CMS plugin popped -> mass defacement on EVERY account on the box + blocklisting of the whole IP range; homogeneity is the multiplier (§2.5, Matrix A signature threat).",
        "Control-panel RCE is the fatal event: roots every box simultaneously (§0.3)."
      ],
      "counters": [
        { "name": "managed-patching-service", "defenseRole": "Recover", "priceTier": "expensive", "note": "occasionally breaks a customer site — you own the outage either way (§2.5)." },
        { "name": "waf-virtual-patching", "defenseRole": "Contain", "priceTier": "lateral" },
        { "name": "per-account-isolation", "defenseRole": "Contain", "priceTier": "cheap" }
      ]
    },
    {
      "id": "noisy-query-table-scan",
      "family": "human",
      "band": "entropy",
      "roles": ["Debuffer"],
      "motion": "hold",
      "denomination": "concurrency",
      "customerAsThreat": true,
      "mechanical": true,
      "visual": "one-fat-query",
      "stats": {
        "sophistication": null,
        "volume": null,
        "signature": null,
        "persistence": null,
        "unindexedScanMs": null,
        "tuningSheet": "PROVISIONAL-B",
        "_todo": "§3.1 gives the unindexed-DB latency band 400-4,000ms ('the Noisy Query's weapon'); the per-incident pressure scalar is untuned."
      },
      "facts": [
        "A query that was fine at 10k rows is fatal at 10M — the threat grows with your success (§2.5).",
        "Signature moment (§1.3): one customer's plugin runs an uncached SELECT * FROM wp_posts on every page load and takes down all 40 tenants; attributable only if the per-account slow-query-log buildable exists."
      ],
      "counters": [